{
  "schemaVersion": "guard.mcp-server-contribution.v1",
  "id": "mcp.xahau-mcp",
  "version": "1.0.0",
  "name": "Xahau MCP",
  "description": "Reviews Xahau MCP tools that read public Xahau JSON-RPC endpoints or emit unsigned transactions and Hook source a user could sign or deploy. Offline codec, Hook WASM analysis, and local VM tools are allowed. The server never signs, submits, or holds keys. Off until you turn it on.",
  "trustClass": "external",
  "activation": "opt-in",
  "publisher": {
    "id": "io.github.hugegreencandle",
    "displayName": "Hugegreencandle (Kairo Vault Technologies G.K.)",
    "url": "https://github.com/Hugegreencandle"
  },
  "icon": { "kind": "react-icon", "name": "HiMiniCube", "background": "#0F172A" },
  "homepage": "https://github.com/Hugegreencandle/xahau-mcp#readme",
  "license": "MIT",
  "launch": {
    "kind": "package-launcher",
    "command": "npx",
    "package": "xahau-mcp"
  },
  "riskClasses": [
    "external-network-read",
    "unsigned-transaction-construction",
    "generated-source-code"
  ],
  "tools": [
    { "name": "decode_hook_on", "state": "allow" },
    { "name": "encode_hook_on", "state": "allow" },
    { "name": "decode_hook_can_emit", "state": "allow" },
    { "name": "encode_hook_can_emit", "state": "allow" },
    { "name": "estimate_hook_state_cost", "state": "allow" },
    { "name": "simulate_hook_trigger", "state": "allow" },
    { "name": "decode_sethook", "state": "allow" },
    { "name": "decode_tx_blob", "state": "allow" },
    { "name": "decode_uritoken_id", "state": "allow" },
    { "name": "xah_amount", "state": "allow" },
    { "name": "validate_address", "state": "allow" },
    { "name": "xaddress", "state": "allow" },
    { "name": "currency_code", "state": "allow" },
    { "name": "decode_result", "state": "allow" },
    { "name": "ripple_time", "state": "allow" },
    { "name": "decode_xpop", "state": "allow" },
    { "name": "inspect_emitted_tx", "state": "allow" },
    { "name": "decode_lease_uri", "state": "allow" },
    { "name": "decode_amount", "state": "allow" },
    { "name": "decode_sign_request", "state": "allow" },
    { "name": "scam_check", "state": "allow" },
    { "name": "inspect_hook_wasm", "state": "allow" },
    { "name": "analyze_hook", "state": "allow" },
    { "name": "list_rules", "state": "allow" },
    { "name": "hook_dry_run", "state": "allow" },
    { "name": "annotate_hook_trace", "state": "allow" },
    { "name": "fuzz_hook", "state": "allow" },
    { "name": "estimate_hook_fee", "state": "allow" },
    { "name": "hook_report", "state": "allow" },
    { "name": "classify_hook", "state": "allow" },
    { "name": "hook_diff", "state": "allow" },
    { "name": "hook_api_lookup", "state": "allow" },
    { "name": "decode_b2m", "state": "allow" },
    { "name": "vm_fidelity_report", "state": "allow" },
    { "name": "build_sethook_unsigned", "state": "review" },
    { "name": "build_claimreward_unsigned", "state": "review" },
    { "name": "build_import_unsigned", "state": "review" },
    { "name": "build_set_regular_key_unsigned", "state": "review" },
    { "name": "build_disable_master_unsigned", "state": "review" },
    { "name": "build_signer_list_set_unsigned", "state": "review" },
    { "name": "build_payment_unsigned", "state": "review" },
    { "name": "build_remit_unsigned", "state": "review" },
    { "name": "build_set_remarks_unsigned", "state": "review" },
    { "name": "build_clawback_unsigned", "state": "review" },
    { "name": "build_deepfreeze_unsigned", "state": "review" },
    { "name": "build_cronset_unsigned", "state": "review" },
    { "name": "prepare_transaction", "state": "review" },
    { "name": "encode_tx_blob", "state": "review" },
    { "name": "scaffold_hook", "state": "review" },
    { "name": "other", "state": "inherit" }
  ],
  "referenceUrls": [
    "https://github.com/Hugegreencandle/xahau-mcp",
    "https://www.npmjs.com/package/xahau-mcp"
  ],
  "saferAlternatives": [
    "Unlisted tools fall to the other row (Inherit). They include every live ledger, governance, amendment, and reward read; use a decode_* or analyze_* tool on data you already have when no live read is needed.",
    "Read the unsigned JSON from a build_* tool, prepare_transaction, or encode_tx_blob before signing it offline. The server never signs or submits.",
    "Set XAHAU_RPC_URLS or XAHAU_TEST_RPC_URLS to pin live reads to a JSON-RPC node you trust."
  ]
}
