{
  "schemaVersion": "guard.mcp-server-contribution.v1",
  "id": "mcp.agenthub",
  "version": "1.0.0",
  "name": "AgentHub MCP",
  "description": "Reviews AgentHub tools that run other coding agents (Codex, Claude Code, Antigravity, Aider, Goose), apply their changes to the working tree, or send code to those agents' providers. Off until you turn it on.",
  "trustClass": "external",
  "activation": "opt-in",
  "publisher": {
    "id": "github.premanand8800",
    "displayName": "AgentHub",
    "url": "https://github.com/premanand8800/agenthub-mcp"
  },
  "icon": { "kind": "react-icon", "name": "HiMiniCommandLine", "background": "#0B0F17" },
  "homepage": "https://github.com/premanand8800/agenthub-mcp",
  "license": "MIT",
  "launch": {
    "kind": "package-launcher",
    "command": "uvx",
    "package": "agenthub-gateway"
  },
  "riskClasses": ["external-command-execution", "external-filesystem-write", "external-code-egress"],
  "tools": [
    { "name": "ask", "state": "review" },
    { "name": "start_task", "state": "review" },
    { "name": "apply_task", "state": "review" },
    { "name": "send_message", "state": "review" },
    { "name": "review", "state": "review" },
    { "name": "compare", "state": "review" },
    { "name": "cancel_task", "state": "inherit" },
    { "name": "discard_task", "state": "inherit" },
    { "name": "other", "state": "inherit" }
  ],
  "referenceUrls": [
    "https://github.com/premanand8800/agenthub-mcp",
    "https://github.com/premanand8800/agenthub-mcp/blob/main/SECURITY.md",
    "https://pypi.org/project/agenthub-gateway/"
  ],
  "saferAlternatives": [
    "Use permission_mode read-only, or start_task with isolation worktree so changes stay in a separate checkout until apply_task.",
    "Use list_agents, get_task, get_task_logs, get_task_diff and the session tools, which only read state."
  ]
}
